question	query
Count me the number of people whose military unit is involved with Close air support?	SELECT DISTINCT COUNT(?uri) WHERE { ?x <role> <Close_air_support> . ?uri <militaryUnit> ?x  . ?uri <type> <MilitaryPerson>}
Where did the president study, whose VP was Emilio Nez?	SELECT DISTINCT ?uri WHERE { ?x <vicePresident> <Emilio_Núñez> . ?x <almaMater> ?uri  . }
Who wrote the album coming right before Dead Man's Chest's OST?	SELECT DISTINCT ?uri WHERE { ?x <nextAlbum> <Pirates_of_the_Caribbean:_Dead_Man's_Chest_(soundtrack)> . ?x <writer> ?uri  . ?x <type> <Album>}
Which cities have the river one of whose Tributary is the Missouri's big spring?	SELECT DISTINCT ?uri WHERE { ?x <rightTributary> <Big_Spring_(Missouri)> . ?x <city> ?uri  . ?x <type> <River>}
Which district of Fort Heath radar station is also the state of Joesph Story ?	SELECT DISTINCT ?uri WHERE { <Fort_Heath_radar_station> <district> ?uri. <Joseph_Story> <state> ?uri}
Give me everything owned by networks which is lead by Steve Burke?	SELECT DISTINCT COUNT(?uri) WHERE { ?x <keyPerson> <Steve_Burke_(businessman)> . ?uri <network> ?x  . }
How many writers worked on the album Main Course?	SELECT DISTINCT COUNT(?uri) WHERE { ?x <album> <Main_Course> . ?x <writer> ?uri  . }
Name the common university of the Cardinal and Jim Wylie?	SELECT DISTINCT ?uri WHERE { <Stanford_Cardinal> <university> ?uri. <Jim_Wylie> <university> ?uri . }
What are some important people in NGOs headed by Donna Shalala?	SELECT DISTINCT ?uri WHERE { ?x <keyPerson> <Donna_Shalala> . ?x <keyPeople> ?uri  . ?x <type> <Non-ProfitOrganisation>}
How many fictional characters are there in a series in which Craig Robinson acted?	SELECT DISTINCT COUNT(?uri) WHERE { ?x <starring> <Craig_Robinson_(actor)> . ?uri <series> ?x  . ?uri <type> <FictionalCharacter>}
How many owners owned the clubs participating in the Premier leagues of '14?	SELECT DISTINCT COUNT(?uri) WHERE { ?x <season> <2014–15_Premier_League> . ?x <owner> ?uri  . }
Who is the stock holder of the bank where  Peter Grauer works  ?	SELECT DISTINCT ?uri WHERE { <Peter_Grauer> <occupation> ?x . ?x <owner> ?uri  . ?x <type> <Bank>}
Which parties have their members live in the PM House, Colombo?	SELECT DISTINCT ?uri WHERE { ?x <residence> <Prime_Minister's_House_(Colombo)> . ?uri <leader> ?x  . ?uri <type> <PoliticalParty>}
List down the TV shows whose producer is Stephen E. Ambros and writer is John Orloff ?	SELECT DISTINCT ?uri WHERE {?uri <producer> <Stephen_E._Ambrose> . ?uri <writer> <John_Orloff>  . ?uri <type> <TelevisionShow>}
Where was Ne daj se, Nina first aired ?	SELECT DISTINCT ?uri WHERE { <Ne_daj_se,_Nina> <firstAired> ?uri }
Who founded the city at the end of the Pittsburgh Line route?	SELECT DISTINCT ?uri WHERE { <Pittsburgh_Line> <routeEnd> ?x . ?x <founder> ?uri  . }
Is Judy Garland a character of End of the Rainbow?	ASK WHERE { <End_of_the_Rainbow> <characters> <Judy_Garland> }
What are some US citizens famous for?	SELECT DISTINCT ?uri WHERE { ?x <nationality> <United_States> . ?x <knownFor> ?uri  . }
Which river's mouth is located in Gulf of Mexico and has source location as Itasca State Park ?	SELECT DISTINCT ?uri WHERE {?uri <riverMouth> <Gulf_of_Mexico> . ?uri <sourceLocation> <Itasca_State_Park>  . ?uri <type> <River>}
Which president of Lance Adams-Schneider had nickname Daniel O'Regan?	SELECT DISTINCT ?uri WHERE { <Lance_Adams-Schneider> <president> ?uri. <Daniel_O'Regan> <nickname> ?uri}
Name the river with mouth as Thames Estuary and passes through Reading Berkshire ?	SELECT DISTINCT ?uri WHERE {?uri <riverMouth> <Thames_Estuary> . ?uri <city> <Reading,_Berkshire>  . ?uri <type> <River>}
Where is the building located whose architect was Francis Palmer Smith?	SELECT DISTINCT ?uri WHERE { ?x <architect> <Francis_Palmer_Smith> . ?x <address> ?uri  . ?x <type> <Building>}
How many corporations were founded in Texas?	SELECT DISTINCT COUNT(?uri) WHERE {?uri <foundationPlace> <Texas>  . ?uri <type> <Company>}
What mountains are in sierra nevada?	SELECT DISTINCT ?uri WHERE {?uri <mountainRange> <Sierra_Nevada_(U.S.)>  . }
Where did Marvo originate?	SELECT DISTINCT ?uri WHERE { <Mavro> <origin> ?uri }
Which football team is in a city where A J Clark was a builder?	SELECT DISTINCT ?uri WHERE { ?x <builder> <A._James_Clark> . ?uri <city> ?x  . ?uri <type> <AmericanFootballTeam>}
What is the residence of the person, who starred in Men Will Be Men ?	SELECT DISTINCT ?uri WHERE { <Men_Will_Be_Men> <starring> ?x . ?x <residence> ?uri  . ?x <type> <Person>}
For which games are Sam Loyd and Eric Schiller both famous?	SELECT DISTINCT ?uri WHERE { <Sam_Loyd> <knownFor> ?uri. <Eric_Schiller> <knownFor> ?uri . }
How many other awards have been given to people who have won the Golden Globe?	SELECT DISTINCT COUNT(?uri) WHERE { ?x <award> <Golden_Globe_Award> . ?x <awards> ?uri  . ?uri <type> <Award>}
Where are the politicians buried who succeeded George Whitefield Davis?	SELECT DISTINCT ?uri WHERE { ?x <predecessor> <George_Whitefield_Davis> . ?x <restingplace> ?uri  . ?x <type> <OfficeHolder>}
Which magazine's editor is married to Crystal Harris?	SELECT DISTINCT ?uri WHERE { ?x <spouse> <Crystal_Harris> . ?uri <editor> ?x  . ?uri <type> <Magazine>}
What cities are around the sea which flows into Marmara?	SELECT DISTINCT ?uri WHERE { ?x <inflow> <Sea_of_Marmara> . ?x <cities> ?uri  . ?x <type> <Sea>}
Name a office holder whose predecessor is Edward Douglass White and has son named Charles Phelps Taft II?	SELECT DISTINCT ?uri WHERE {?uri <predecessor> <Edward_Douglass_White> . ?uri <child> <Charles_Phelps_Taft_II>  . ?uri <type> <OfficeHolder>}
Who was the chairman of Fort Lauderdale Strikers and also 2015 Fort Lauderdale Strikers season ?	SELECT DISTINCT ?uri WHERE { <2015_Fort_Lauderdale_Strikers_season> <chairman> ?uri. <Fort_Lauderdale_Strikers> <chairman> ?uri . }
Which music band made Take Me There, and to which Tedd Riley was associated?	SELECT DISTINCT ?uri WHERE { <Teddy_Riley> <associatedBand> ?uri. <Take_Me_There_(Blackstreet_&_Mýa_song)> <musicalBand> ?uri}
What is the mountain whose parent mountain peak is Nevado de Toluca?	SELECT DISTINCT ?uri WHERE {?uri <parentMountainPeak> <Nevado_de_Toluca>  . ?uri <type> <Mountain>}
Who is the cover artist of Doctor Mirabilis (novel)?	SELECT DISTINCT ?uri WHERE { <Doctor_Mirabilis_(novel)> <coverArtist> ?uri }
For how many other teams have the former players of Boston Bruins played?	SELECT DISTINCT COUNT(?uri) WHERE { ?x <formerTeam> <Boston_Bruins> . ?x <playedFor> ?uri  . ?uri <type> <SportsTeam>}
Name the appliance produced by Foxconn and its OS is provided by PlayStation 3 system software?	SELECT DISTINCT ?uri WHERE {?uri <manufacturer> <Foxconn> . ?uri <os> <PlayStation_3_system_software>  . ?uri <type> <InformationAppliance>}
How many teams have used the stadium which hosted the WCW mayhem?	SELECT DISTINCT COUNT(?uri) WHERE { <WCW_Mayhem> <venue> ?x . ?x <tenant> ?uri  . ?x <type> <Stadium>}
What is the title of Kakae?	SELECT DISTINCT ?uri WHERE { <Kakae> <title> ?uri }
In which city are buildings by Solon Spencer Beman found?	SELECT DISTINCT ?uri WHERE { ?x <architect> <Solon_Spencer_Beman> . ?x <locationTown> ?uri  . ?x <type> <Building>}
Who developed the software which is used as operating system of Magic Trackpad ?	SELECT DISTINCT ?uri WHERE { <Magic_Trackpad> <operatingSystem> ?x . ?x <developer> ?uri  . ?x <type> <Software>}
Name the champion of National League?	SELECT DISTINCT ?uri WHERE { <National_League> <champion> ?uri }
What are some products of the the company whose subsidiary is Sony Corp shareholders and subsidies?	SELECT DISTINCT ?uri WHERE { ?x <subsidiary> <Sony_Corporation_shareholders_and_subsidiaries> . ?uri <manufacturer> ?x  . }
How many games are played at universities in Metro Manilla?	SELECT DISTINCT COUNT(?uri) WHERE { ?x <state> <Metro_Manila> . ?x <athletics> ?uri  . }
List the successor of successor of Hayden, Stone & Co.	SELECT DISTINCT ?uri WHERE { <Hayden,_Stone_&_Co.> <successor> ?x . ?x <successor> ?uri  . }
What sporting goods companies are located in Herzogenaurach?	SELECT DISTINCT ?uri WHERE {?uri <location> <Herzogenaurach> }
Name the office holder whose spouse is Dolley Madison and belongs to Militia branch ?	SELECT DISTINCT ?uri WHERE {?uri <spouse> <Dolley_Madison> . ?uri <branch> <Militia>  . ?uri <type> <OfficeHolder>}
In which war did the units garrisoned at Turin fight?	SELECT DISTINCT ?uri WHERE { ?x <garrison> <Turin> . ?x <battle> ?uri  . }
Muhammad Yunus has won how many awards?	SELECT DISTINCT COUNT(?uri) WHERE { <Muhammad_Yunus> <award> ?uri  . }
How many mountain are there in Sierra Nevada range?	SELECT DISTINCT COUNT(?uri) WHERE {?uri <mountainRange> <Sierra_Nevada_(U.S.)>  . ?uri <type> <Mountain>}
What were the occupations of Marcus Floyd?	SELECT DISTINCT ?uri WHERE { <Marcus_Floyd> <occupation> ?uri }
What are the awards won by the film director of Saraband ?	SELECT DISTINCT ?uri WHERE { <Saraband> <director> ?x . ?x <awards> ?uri  . }
Did Stan Lee narrate The Incredible Hulk tv show?	ASK WHERE { <The_Incredible_Hulk_(1982_TV_series)> <narrator> <Stan_Lee> }
Name the people whose residence is Beverly Hills, California?	SELECT DISTINCT ?uri WHERE {?uri <residence> <Beverly_Hills,_California>  . ?uri <type> <Person>}
Which person naratted The Incredible Hulk and also the writer of Tales of Suspense?	SELECT DISTINCT ?uri WHERE { <The_Incredible_Hulk_(1982_TV_series)> <narrated> ?uri. <Tales_of_Suspense> <writers> ?uri}
What has been founded in the state that Denton county, Texas is a part of? 	SELECT DISTINCT ?uri WHERE { ?x <part> <Denton_County,_Texas> . ?uri <foundationPlace> ?x  . }
List the television shows whose network's executive officer is Steve Burke.	SELECT DISTINCT ?uri WHERE { ?x <keyPerson> <Steve_Burke_(businessman)> . ?uri <network> ?x  . ?uri <type> <TelevisionShow>}
What are the nearest city to the historic places whose one of the nearest city is Wisconsin?	SELECT DISTINCT ?uri WHERE { ?x <nearestCity> <Wisconsin> . ?x <nearestCity> ?uri  . ?x <type> <HistoricPlace>}
What is debut team of the baseball players who died in Los Angeles?	SELECT DISTINCT ?uri WHERE { ?x <deathPlace> <Los_Angeles> . ?x <debutteam> ?uri  . ?x <type> <BaseballPlayer>}
Among the companies who has product named Chinook who has a key person as Dennis Muilenburg ?	SELECT DISTINCT ?uri WHERE {?uri <keyPeople> <Dennis_Muilenburg> . ?uri <products> <Boeing_CH-47_Chinook>  . ?uri <type> <Company>}
Which football players have Newell's Old Boys as youthclub?	SELECT DISTINCT ?uri WHERE {?uri <youthclubs> <Newell's_Old_Boys> }
Which battle did both Steven Palazao and tony hogg fight in?	SELECT DISTINCT ?uri WHERE { <Steven_Palazzo> <battles> ?uri. <Tony_Hogg> <battles> ?uri . }
Which soccer players are currently playing for NYC FC?	SELECT DISTINCT ?uri WHERE {?uri <currentclub> <New_York_City_FC>  . ?uri <type> <SoccerPlayer>}
How many games have been composed by Hirokazu Tanaka?	SELECT DISTINCT COUNT(?uri) WHERE {?uri <composer> <Hirokazu_Tanaka>  . ?uri <type> <VideoGame>}
What is the total number of software whose programming language is C++ and operating system is Microsoft Windows?	SELECT DISTINCT COUNT(?uri) WHERE {?uri <programmingLanguage> <C++> . ?uri <operatingSystem> <Microsoft_Windows> }
tell me the school to which Cyril Hume went?	SELECT DISTINCT ?uri WHERE { <Cyril_Hume> <education> ?uri }
Name the fictional character whose relatives are Huey, Dewey, and Louie and belongs to Duck family ?	SELECT DISTINCT ?uri WHERE {?uri <relatives> <Huey,_Dewey,_and_Louie> . ?uri <relative> <Duck_family_(Disney)>  . ?uri <type> <FictionalCharacter>}
In which country is there a dam on the Awash river?	SELECT DISTINCT ?uri WHERE { ?x <river> <Awash_River> . ?x <country> ?uri  . ?x <type> <Dam>}
Who is the american football player whose highschool is Ringgold High School (Pennsylvania)?	SELECT DISTINCT ?uri WHERE {?uri <highschool> <Ringgold_High_School_(Pennsylvania)> }
Companies founded in Taiwan have typically which divisions?	SELECT DISTINCT ?uri WHERE { ?x <foundationPlace> <Taiwan> . ?x <division> ?uri  . ?x <type> <Company>}
How many other ingredient are there in the foods which have one of the ingredient as Potato ?	SELECT DISTINCT COUNT(?uri) WHERE { ?x <ingredient> <Potato> . ?x <ingredient> ?uri }
What teams did the ex teamplayers of lighthouse boy club start their career with?	SELECT DISTINCT ?uri WHERE { ?x <youthclubs> <Lighthouse_Boys_Club> . ?x <debutteam> ?uri  . }
What awards did Jos Rivera (playwright) win?	SELECT DISTINCT ?uri WHERE { <José_Rivera_(playwright)> <awards> ?uri }
Count number of people who follow a religion which has an important office in Gold Base?	SELECT DISTINCT COUNT(?uri) WHERE { ?x <headquarters> <Gold_Base> . ?uri <religion> ?x  . ?uri <type> <Person>}
Name the office holder who has a child named Lori Black and resting place is Alta Mesa Memorial Park?	SELECT DISTINCT ?uri WHERE {?uri <child> <Lori_Black> . ?uri <restingPlace> <Alta_Mesa_Memorial_Park>  . ?uri <type> <OfficeHolder>}
Which company owns instagram?	SELECT DISTINCT ?uri WHERE {?uri <subsidiary> <Instagram> }
List the characters of Lysistrata ?	SELECT DISTINCT ?uri WHERE { <Lysistrata> <characters> ?uri }
Who all have been judges on CTV Network's shows?	SELECT DISTINCT ?uri WHERE { ?x <network> <CTV_Television_Network> . ?x <judges> ?uri  . ?x <type> <TelevisionShow>}
List the houses of Parliament of India ?	SELECT DISTINCT ?uri WHERE { <Parliament_of_India> <houses> ?uri }
Cleopatra V of Egypt is mother to which royalty?	SELECT DISTINCT ?uri WHERE {?uri <mother> <Cleopatra_V_of_Egypt> }
Which range of mountains are there in canton of Fribourg?	SELECT DISTINCT ?uri WHERE { ?x <locatedInArea> <Canton_of_Fribourg> . ?x <mountainRange> ?uri  . }
Which rivers start in a country whose leader is Irene Mambilima?	SELECT DISTINCT ?uri WHERE { ?x <leaderName> <Irene_Mambilima> . ?uri <sourceCountry> ?x  . ?uri <type> <River>}
Give me the total number of membership of the organisations which have memebers as Azerbaijan?	SELECT DISTINCT COUNT(?uri) WHERE { ?x <membership> <Azerbaijan> . ?x <membership> ?uri }
where is the thorington train station located?	SELECT DISTINCT ?uri WHERE { <Thorington_railway_station> <district> ?uri }
In which ice hockey league, did the team coached by Joel Quenneville win?	SELECT DISTINCT ?uri WHERE { ?x <headCoach> <Joel_Quenneville> . ?uri <champion> ?x  . ?uri <type> <IceHockeyLeague>}
Which TV show had a judge named Harry Connick, Jr. and was presented by Ryan Seacrest?	SELECT DISTINCT ?uri WHERE {?uri <judges> <Harry_Connick,_Jr.> . ?uri <presenter> <Ryan_Seacrest>  . ?uri <type> <TelevisionShow>}
Who is the father of Barbara Ann Crancer?	SELECT DISTINCT ?uri WHERE {?uri <child> <Barbara_Ann_Crancer>  . }
What is the military rank of the important commander of Peruvian Army?	SELECT DISTINCT ?uri WHERE { <Peruvian_Army> <notableCommander> ?x . ?x <militaryRank> ?uri  . }
Who operates Liverpool Playhouse ?	SELECT DISTINCT ?uri WHERE { <Liverpool_Playhouse> <operatedBy> ?uri }
Where is the fictional character from, whose last appearance was in the Avengers, 1998?	SELECT DISTINCT ?uri WHERE { ?x <last> <The_Avengers_(1998_film)> . ?x <nationality> ?uri  . ?x <type> <FictionalCharacter>}
List the leaders of all the cities through which the Ganga river flows ?	SELECT DISTINCT ?uri WHERE { <Ganges> <city> ?x . ?x <leaderName> ?uri  . ?x <type> <City>}
What is the sea connected to Oulu and Turku?	SELECT DISTINCT ?uri WHERE { ?uri <cities> <Oulu> . ?uri <cities> <Turku> . ?uri <type> <Sea>}
Who are the writers of South Park: The Stick of Truth?	SELECT DISTINCT ?uri WHERE { <South_Park:_The_Stick_of_Truth> <writer> ?uri }
Count the number of battles fought by the military person involved in Morocco?	SELECT DISTINCT COUNT(?uri) WHERE { ?x <battles> <Morocco> . ?x <battles> ?uri }
What is the birthplace of Ludovic Boi which is also the residence of Fernando Augustin?	SELECT DISTINCT ?uri WHERE { <Ludovic_Boi> <birthPlace> ?uri. <Fernando_Augustin> <residence> ?uri . }
What is the source country of Water resources managemnt in EL Salvador is also the land of Jos MAra Orellana ?	SELECT DISTINCT ?uri WHERE { <Water_resources_management_in_El_Salvador> <sourceCountry> ?uri. <José_María_Orellana> <country> ?uri}
Who is the composer of Girl from the North Country ?	SELECT DISTINCT ?uri WHERE { <Girl_from_the_North_Country> <composer> ?uri }
Which arena of WPC Dynamo Moscow is death location of Tigran Petrosian?	SELECT DISTINCT ?uri WHERE { <WPC_Dynamo_Moscow> <arena> ?uri. <Tigran_Petrosian> <deathPlace> ?uri}
Daniel L D Granger and Job Durfee have based their political career in which US state?	SELECT DISTINCT ?uri WHERE { <Daniel_L._D._Granger> <state> ?uri. <Job_Durfee> <state> ?uri . }
Where is Vietnam Airlines located?	SELECT DISTINCT ?uri WHERE { <Vietnam_Airlines> <location> ?uri }
List the primary  subjects of A Christian Turn'd Turk?	SELECT DISTINCT ?uri WHERE { <A_Christian_Turn'd_Turk> <subject> ?uri }
Who appointed William L. Dayton ?	SELECT DISTINCT ?uri WHERE { <William_L._Dayton> <appointer> ?uri }
Which magazine's editor's official residence is Playboy Mansion?	SELECT DISTINCT ?uri WHERE { ?x <residence> <Playboy_Mansion> . ?uri <editor> ?x  . ?uri <type> <Magazine>}
Which countries came together to serve a greater purpose and founded South Asia Subregional Economic Cooperation?	SELECT DISTINCT ?uri WHERE { <South_Asia_Subregional_Economic_Cooperation> <membership> ?uri }
What are the academic interests of the advisor of Paul Demiville ?	SELECT DISTINCT ?uri WHERE { <Paul_Demiéville> <academicAdvisor> ?x . ?x <fields> ?uri  . }
Is Darcs released with a GNU license?	ASK WHERE { <Darcs> <license> <GNU> }
What are the broadcast areas of Mauritius Broadcasting Corporation?	SELECT DISTINCT ?uri WHERE { <Mauritius_Broadcasting_Corporation> <broadcastArea> ?uri }
Which river goes through cohoes, NY	SELECT DISTINCT ?uri WHERE { <Cohoes,_New_York> <river> ?uri }
Which religion is followed by people in the family of Meadow Sopranos?	SELECT DISTINCT ?uri WHERE { ?x <family> <Meadow_Soprano> . ?x <religion> ?uri  . ?x <type> <Person>}
Which writer of Tales of Suspense is also the writer of karakuri Dji Ultimo ?	SELECT DISTINCT ?uri WHERE { <Tales_of_Suspense> <writers> ?uri. <Karakuri_Dôji_Ultimo> <author> ?uri}
Who is the builder of the bridge owned by Tabriz?	SELECT DISTINCT ?uri WHERE { ?x <owner> <Tabriz> . ?x <builder> ?uri  . ?x <type> <Bridge>}
Count the different causes of death of Christians.	SELECT DISTINCT COUNT(?uri) WHERE { ?x <religion> <Christianity> . ?x <deathCause> ?uri  . }
Which educational institution of Jack Mcgregor is also the alma mater of Donn barber?	SELECT DISTINCT ?uri WHERE { <Jack_McGregor> <education> ?uri. <Donn_Barber> <education> ?uri . }
What is the location of Sam Sen Railway Station?	SELECT DISTINCT ?uri WHERE { <Sam_Sen_Railway_Station> <other> ?uri }
How many countries surround the sea into which the Upper Neratva flow?	SELECT DISTINCT COUNT(?uri) WHERE { <Upper_Neretva> <riverMouth> ?x . ?x <country> ?uri  . ?x <type> <Sea>}
What is the religion of character of Janice Soprano from The Soprano television show?	SELECT DISTINCT ?uri WHERE { <Janice_Soprano> <religion> ?uri }
What is the residence of the bronze medalist of Alpine skiing at the women's downhill competition at the 1972 Winter Olympics?	SELECT DISTINCT ?uri WHERE { <Alpine_skiing_at_the_1972_Winter_Olympics_–_Women's_downhill> <bronzeMedalist> ?x . ?x <birthPlace> ?uri  . }
Sampson Cudjoe plays for the Ghana national team?	ASK WHERE { <Sampson_Cudjoe> <nationalteam> <Ghana> }
is blue lagoon island a part of the bahamas achipelago?	ASK WHERE { <Blue_Lagoon_Island> <archipelago> <The_Bahamas> }
Give the total number of places to which airlines go, who also go to Glasgow?	SELECT DISTINCT COUNT(?uri) WHERE { ?x <targetAirport> <Glasgow_Airport> . ?x <destinations> ?uri  . ?uri <type> <Place>}
Where was the successor of Hank Brown born?	SELECT DISTINCT ?uri WHERE { <Hank_Brown> <successor> ?x . ?x <birthPlace> ?uri  . }
How many different religions have economists followed?	SELECT DISTINCT COUNT(?uri) WHERE { ?x <profession> <Economist> . ?x <religion> ?uri  . }
What are some units udner the US department of navy?	SELECT DISTINCT ?uri WHERE {?uri <commandStructure> <United_States_Department_of_the_Navy> }
In which race did Coneygree the racehorse and Fergie Sutherland the horse trainer participate?	SELECT DISTINCT ?uri WHERE { <Fergie_Sutherland> <race> ?uri. <Coneygree> <race> ?uri . }
What relegious affiliation of Josiah Idowu-Fearon was canonized by john of Damasucs ?	SELECT DISTINCT ?uri WHERE { <John_of_Damascus> <canonizedBy> ?uri. <Josiah_Idowu-Fearon> <religion> ?uri}
Which hockey teams have had people playing as Defenceman?	SELECT DISTINCT ?uri WHERE { ?x <position> <Defenceman> . ?x <playedFor> ?uri  . ?x <type> <IceHockeyPlayer>}
Which area is the operator of the South Side Elevated Railroad and also the palce of death of Sakari Suzuki ?	SELECT DISTINCT ?uri WHERE { <South_Side_Elevated_Railroad> <operatedBy> ?uri. <Sakari_Suzuki> <deathPlace> ?uri}
Which team won the American Football League?	SELECT DISTINCT ?uri WHERE { <American_Football_League> <champion> ?uri }
List the cast member of the movies whose producer is Mark Johnson.	SELECT DISTINCT ?uri WHERE { ?x <producer> <Mark_Johnson_(producer)> . ?x <starring> ?uri  . ?x <type> <Film>}
Who was the director of photography of Mickey's Mellerdrammer and the animator of Tommy Tucker's Tooth?	SELECT DISTINCT ?uri WHERE { <Mickey's_Mellerdrammer> <cinematography> ?uri. <Tommy_Tucker's_Tooth> <animator> ?uri}
Name the band atleast one of whose members is famous for playing the Fender Stratocaster?	SELECT DISTINCT ?uri WHERE { ?x <notableInstruments> <Fender_Stratocaster> . ?uri <currentMembers> ?x  . ?uri <type> <Band>}
Which company owns Evraz?	SELECT DISTINCT ?uri WHERE { <Evraz> <owningCompany> ?uri }
What are the movies whose director's daughter is Luke Scott?	SELECT DISTINCT ?uri WHERE { ?x <child> <Luke_Scott_(director)> . ?uri <director> ?x  . ?uri <type> <Film>}
Which person created the women in the garden?	SELECT DISTINCT ?uri WHERE { <Women_in_the_Garden> <artist> ?uri }
Who owns the ford kansas assembly plant?	SELECT DISTINCT ?uri WHERE { <Ford_Kansas_City_Assembly_Plant> <owningOrganisation> ?uri }
What is the currency of the government type of Kerguelen Islands?	SELECT DISTINCT ?uri WHERE { <Kerguelen_Islands> <governmentType> ?x . ?x <currency> ?uri  . }
Which driver came first in the 1993 European Grand Prix ?	SELECT DISTINCT ?uri WHERE { <1993_European_Grand_Prix> <firstDriver> ?uri }
Which city's governing body is led by Bruce Harrell?	SELECT DISTINCT ?uri WHERE { ?x <leader> <Bruce_Harrell> . ?uri <governingBody> ?x  . }
Which fictional character portrayed by Roger barton has Padm Amidala as family ?	SELECT DISTINCT ?uri WHERE {?uri <portrayer> <Roger_Barton_(film_editor)> . ?uri <family> <Padmé_Amidala>  . ?uri <type> <FictionalCharacter>}
Who is the artist of Sings Kristofferson and also performed Milk Cow Blues atleast once?	SELECT DISTINCT ?uri WHERE { <Sings_Kristofferson> <artist> ?uri. <Milk_Cow_Blues> <artist> ?uri . }
Is joel quenneville the main coach of Chicago Blackhawks?	ASK WHERE { <Chicago_Blackhawks> <headCoach> <Joel_Quenneville> }
How many books are there whose author's tomb is in Madrid?	SELECT DISTINCT COUNT(?uri) WHERE { ?x <restingPlace> <Madrid> . ?uri <author> ?x  . ?uri <type> <Book>}
Which associate of Martin Pugh is also married to Alana Stewert?	SELECT DISTINCT ?uri WHERE { <Martin_Pugh> <associatedActs> ?uri. <Alana_Stewart> <spouse> ?uri}
Who owns the bridge which crosses the Orange Line of MBTA?	SELECT DISTINCT ?uri WHERE { ?x <crosses> <Orange_Line_(MBTA)> . ?x <owner> ?uri  . ?x <type> <Bridge>}
What awards did the film director of The Haunted House win?	SELECT DISTINCT ?uri WHERE { <The_Haunted_House_(1929_film)> <director> ?x . ?x <award> ?uri  . }
What is the academic discipline of the Journal of Cerebral Blood Flow & Metabolism and also an ingredient of the Ragout fin ?	SELECT DISTINCT ?uri WHERE { <Journal_of_Cerebral_Blood_Flow_&_Metabolism> <academicDiscipline> ?uri. <Ragout_fin> <ingredient> ?uri}
How many movies were directed by the graduate of Burbank High School ?	SELECT DISTINCT COUNT(?uri) WHERE { ?x <education> <Burbank_High_School_(Burbank,_California)> . ?uri <director> ?x  . ?uri <type> <Film>}
Is Seattle the Ship builder of USS Marmora (IX-189)?	ASK WHERE { <USS_Marmora_(IX-189)> <shipBuilder> <Seattle> }
What faiths are followed by the relatives of Meadow Soprano?	SELECT DISTINCT ?uri WHERE { <Meadow_Soprano> <relative> ?x . ?x <religion> ?uri  . }
What is the prize awarded to Bruce Beutler ?	SELECT DISTINCT ?uri WHERE { <Bruce_Beutler> <award> ?uri }
To what did the parliament member swore her oath to, whose son is Lohan Ratwatte?	SELECT DISTINCT ?uri WHERE { ?x <child> <Lohan_Ratwatte> . ?x <allegiance> ?uri  . ?x <type> <MemberOfParliament>}
"What shows used to air on the channel which was earlier known as ""The Comedy Central""?"	SELECT DISTINCT ?uri WHERE { ?x <predecessor> <The_Comedy_Channel_(United_States)> . ?uri <distributor> ?x  . ?uri <type> <TelevisionShow>}
Who is the founder of Oprah Winfrey Network (U.S. TV channel) ?	SELECT DISTINCT ?uri WHERE { <Oprah_Winfrey_Network_(U.S._TV_channel)> <founder> ?uri }
Who appointed the successor of Thomas Bee?	SELECT DISTINCT ?uri WHERE { <Thomas_Bee> <successor> ?x . ?x <appointer> ?uri  . }
How many producers have casted Michael Jackson?	SELECT DISTINCT COUNT(?uri) WHERE { ?x <starring> <Michael_Jackson> . ?x <producer> ?uri  . }
Was the cover of The adventures of Tom Sawyer designed by Mark Twain?	ASK WHERE { <The_Adventures_of_Tom_Sawyer> <coverArtist> <Mark_Twain> }
