question	query
How many cars succeeded the cars which were similar to Cadillac Fleetwood?	SELECT DISTINCT COUNT(?uri) WHERE { <Cadillac_Fleetwood> <related> ?x . ?x <predecessor> ?uri  . ?x <type> <Automobile>}
Who has given guest appearances on the TV Episodes whose music was done by Mama Makes 3?	SELECT DISTINCT ?uri WHERE { ?x <music> <Mama_Makes_Three> . ?x <guests> ?uri  . ?x <type> <TelevisionEpisode>}
Does the croton river flow into the hudson?	ASK WHERE { <Hudson_River> <leftTributary> <Croton_River> }
Name the office holder whose predecessor is Henry E. Catto, Jr. and won Screen Actors Guild Life Achievement Award?	SELECT DISTINCT ?uri WHERE {?uri <predecessor> <Henry_E._Catto,_Jr.> . ?uri <award> <Screen_Actors_Guild_Life_Achievement_Award>  . ?uri <type> <OfficeHolder>}
Is Mona Lisa in the Louvre museum?	ASK WHERE { <Mona_Lisa> <museum> <Louvre> }
Whose theme music is composed by the band one of whose member is Les Claypool?	SELECT DISTINCT ?uri WHERE { ?x <bandMember> <Les_Claypool> . ?uri <themeMusicComposer> ?x  . }
Which artists trained in San Francisco Art Institute?	SELECT DISTINCT ?uri WHERE {?uri <training> <San_Francisco_Art_Institute>  . ?uri <type> <Artist>}
Who designed the bridge over the Valaichchenai lagoon?	SELECT DISTINCT ?uri WHERE { ?x <crosses> <Valaichchenai_Lagoon> . ?x <designer> ?uri  . ?x <type> <Bridge>}
Who is the husband of Rosie Huntington Whiteley?	SELECT DISTINCT ?uri WHERE { <Rosie_Huntington-Whiteley> <partner> ?uri }
Which person won Screen actors Guild Life Time Achievement award and has resting palce in Palo Alto, California ?	SELECT DISTINCT ?uri WHERE {?uri <restingPlace> <Palo_Alto,_California> . ?uri <award> <Screen_Actors_Guild_Life_Achievement_Award>  . ?uri <type> <Person>}
How many different pole drivers are there, of the GPs when Renault was the first team?	SELECT DISTINCT COUNT(?uri) WHERE { ?x <firstTeam> <Renault_in_Formula_One> . ?x <poleDriver> ?uri  . ?uri <type> <FormulaOneRacer>}
How many have been awarded by the Royal Society?	SELECT DISTINCT COUNT(?uri) WHERE {?uri <awards> <Royal_Society>  . }
List some songwriters whose work has been recorded in Miami?	SELECT DISTINCT ?uri WHERE { ?x <recordedIn> <Miami> . ?x <writer> ?uri  . ?x <type> <Work>}
Who has written works found in the Gangan comics?	SELECT DISTINCT ?uri WHERE { ?x <magazine> <Gangan_Comics> . ?x <author> ?uri  . }
What is the common governing body of the Naval Air Facility Adak and Oahu Railway and Land Company?	SELECT DISTINCT ?uri WHERE { <Naval_Air_Facility_Adak> <governingBody> ?uri. <Oahu_Railway_and_Land_Company> <governingBody> ?uri . }
What is the largest city of the country which have an assembly of Plymouth Savoy?	SELECT DISTINCT ?uri WHERE { <Plymouth_Savoy> <assembly> ?x . ?x <largestCity> ?uri  . }
List the awards won by the cinematographer of Mickey's Mellerdrammer?	SELECT DISTINCT ?uri WHERE { <Mickey's_Mellerdrammer> <cinematography> ?x . ?x <award> ?uri  . }
Where is Jimmy Wales a board member which also owns Latvian Wikipedia?	SELECT DISTINCT ?uri WHERE { <Jimmy_Wales> <board> ?uri. <Latvian_Wikipedia> <owner> ?uri}
Count all the ethinic group who speaks language which belongs to Anglo-Frisian language family?	SELECT DISTINCT COUNT(?uri) WHERE { ?x <languageFamily> <Anglo-Frisian_languages> . ?uri <languages> ?x  . ?uri <type> <EthnicGroup>}
Is Philosophy the academic discipline of Think (journal)?	ASK WHERE { <Think_(journal)> <academicDiscipline> <Philosophy> }
Musical artists who are associated with Ren & Angela were born where ?	SELECT DISTINCT ?uri WHERE { ?x <associatedActs> <René_&_Angela> . ?x <birthPlace> ?uri  . ?x <type> <MusicalArtist>}
What sport has made Eric Schiller famous, and has employed Craig Van Tibury?	SELECT DISTINCT ?uri WHERE { <Craig_Van_Tilbury> <occupation> ?uri. <Eric_Schiller> <knownFor> ?uri}
Which awards are presented by Swedish Academy?	SELECT DISTINCT ?uri WHERE {?uri <presenter> <Swedish_Academy>  . ?uri <type> <Award>}
Is God Save the Queen the national anthem of United Kingdom?	ASK WHERE { <United_Kingdom> <nationalAnthem> <God_Save_the_Queen> }
Name the sports played by PATTS College of Aeronautics?	SELECT DISTINCT ?uri WHERE { <PATTS_College_of_Aeronautics> <athletics> ?uri }
Which universities are also known as the Tulane Green wave?	SELECT DISTINCT ?uri WHERE {?uri <nickname> <Tulane_Green_Wave>  . ?uri <type> <University>}
List all the major shrines of the saints which has one of the shrines as Debre Libanos ?	SELECT DISTINCT ?uri WHERE { ?x <majorShrine> <Debre_Libanos> . ?x <majorShrine> ?uri  . ?x <type> <Saint>}
What is the common relegion of Miao people and the country where Guru Purnima is celebrated ?	SELECT DISTINCT ?uri WHERE { <Miao_people> <religion> ?uri. <Guru_Purnima> <country> ?uri}
What is the common school of Chris Marve and Neria Douglass?	SELECT DISTINCT ?uri WHERE { <Chris_Marve> <school> ?uri. <Neria_Douglass> <almaMater> ?uri}
Count the battles fought by Raoul Magrin-Vernerey?	SELECT DISTINCT COUNT(?uri) WHERE { <Raoul_Magrin-Vernerey> <battles> ?uri  . ?uri <type> <MilitaryConflict>}
List the television shows whose network's sister names is N-tv.	SELECT DISTINCT ?uri WHERE { ?x <sisterNames> <N-tv> . ?uri <network> ?x  . ?uri <type> <TelevisionShow>}
What are some famous artists who rocked a Les Paul?	SELECT DISTINCT ?uri WHERE {?uri <notableInstruments> <Gibson_Les_Paul>  . ?uri <type> <MusicalArtist>}
Where did the editor of Charlie Mensuel die ?	SELECT DISTINCT ?uri WHERE { <Charlie_Mensuel> <editor> ?x . ?x <placeOfDeath> ?uri  . }
Saores de costa built a bridge over which river?	SELECT DISTINCT ?uri WHERE { ?x <builder> <Soares_da_Costa> . ?x <crosses> ?uri  . ?x <type> <Bridge>}
To what region is Sukhumbhand Paribatra, a leader?	SELECT DISTINCT ?uri WHERE {?uri <leaderName> <Sukhumbhand_Paribatra>  . ?uri <type> <Region>}
Who is the mfr. of the engine used in Ford Transit?	SELECT DISTINCT ?uri WHERE { <Ford_Transit> <engine> ?x . ?x <manufacturer> ?uri  . ?x <type> <Engine>}
list some shawnee people?	SELECT DISTINCT ?uri WHERE {?uri <nationality> <Shawnee> }
Which philosophy journal has compiler as Stephen Law ?	SELECT DISTINCT ?uri WHERE {?uri <editor> <Stephen_Law> . ?uri <discipline> <Philosophy>  . ?uri <type> <AcademicJournal>}
Which current players once played for Toronto argonauts?	SELECT DISTINCT ?uri WHERE {?uri <formerTeam> <Toronto_Argonauts>  . ?uri <type> <AmericanFootballPlayer>}
How many other race are there of the adult (pornographic) actors whose ethnicity is Cherokee ?	SELECT DISTINCT COUNT(?uri) WHERE { ?x <ethnicity> <Cherokee> . ?x <ethnicity> ?uri }
What was the stadium of Panionios G.S.S. in 2014-15 season ?	SELECT DISTINCT ?uri WHERE { <2014–15_Panionios_G.S.S._season> <stadium> ?uri }
Who is the chancellor of the university which affiliates the Dartington College of Arts?	SELECT DISTINCT ?uri WHERE { ?x <affiliations> <Dartington_College_of_Arts> . ?x <chancellor> ?uri  . ?x <type> <University>}
Name the subsidary of Tandem Computers which was founded by Jim Harris ?	SELECT DISTINCT ?uri WHERE {?uri <subsidiary> <Tandem_Computers> . ?uri <foundedBy> <Jim_Harris_(entrepreneur)>  . ?uri <type> <Company>}
Which president had lieutenants whose governor was Bill Clinton?	SELECT DISTINCT ?uri WHERE { ?x <governor> <Bill_Clinton> . ?uri <lieutenant> ?x  . ?uri <type> <President>}
Who are all the people who used to figure skate with the current partner of Alexa Scimeca?	SELECT DISTINCT ?uri WHERE { <Alexa_Scimeca> <currentPartner> ?x . ?x <formerPartner> ?uri  . }
Which mountain is located in inyo National Forest and has a parent peak named Nevado de Toluca ?	SELECT DISTINCT ?uri WHERE {?uri <locatedInArea> <Inyo_National_Forest> . ?uri <parentMountainPeak> <Nevado_de_Toluca>  . ?uri <type> <Mountain>}
What are the schools whose city is Reading, Berkshire?	SELECT DISTINCT ?uri WHERE {?uri <city> <Reading,_Berkshire> }
Which rivers have source origins asnorth western, Zambia ?	SELECT DISTINCT ?uri WHERE {?uri <sourceRegion> <North-Western_Province,_Zambia>  . ?uri <type> <River>}
Who are the spouse of the actors of Wrongfully Accused?	SELECT DISTINCT ?uri WHERE { <Wrongfully_Accused> <starring> ?x . ?x <spouse> ?uri  . }
What is the layout of Subaru Legacy (second generation) ?	SELECT DISTINCT ?uri WHERE { <Subaru_Legacy_(second_generation)> <layout> ?uri }
Which home town of Cline Buckens is the place of Death of Richard heron?	SELECT DISTINCT ?uri WHERE { <Céline_Buckens> <hometown> ?uri. <Richard_Heron> <placeOfDeath> ?uri}
Was A foreign policy on freedom covered by John Trumbull?	ASK WHERE { <A_Foreign_Policy_of_Freedom> <coverArtist> <John_Trumbull> }
Who is the president of Carl Stokes and Wyche Fowler ?	SELECT DISTINCT ?uri WHERE { <Carl_Stokes> <president> ?uri. <Wyche_Fowler> <president> ?uri}
Who commanded the invasion of Buwat and made Fatima bint Sa'd famous?	SELECT DISTINCT ?uri WHERE { <Invasion_of_Buwat> <commander> ?uri. <Fatimah_bint_Sa'd> <knownFor> ?uri . }
Which is the largest city of Union State ?	SELECT DISTINCT ?uri WHERE { <Union_State> <largestCity> ?uri }
How many rivers end in the Indian Ocean?	SELECT DISTINCT COUNT(?uri) WHERE {?uri <riverMouth> <Indian_Ocean>  . ?uri <type> <River>}
Name the person whose mother name is Cedella Booker and has a son named Sharon Marley?	SELECT DISTINCT ?uri WHERE {?uri <parent> <Cedella_Booker> . ?uri <children> <Sharon_Marley>  . ?uri <type> <Person>}
Name the partners of Kelly Brook?	SELECT DISTINCT ?uri WHERE { <Kelly_Brook> <partner> ?uri }
What type of government is elected in Kumta?	SELECT DISTINCT ?uri WHERE { <Kumta> <governmentType> ?uri }
Name the company with product named Microsft Azure and provides OneDrive as a service ?	SELECT DISTINCT ?uri WHERE {?uri <product> <Microsoft_Azure> . ?uri <services> <OneDrive>  . ?uri <type> <Company>}
List all the notable works of  Russell T Davies?	SELECT DISTINCT ?uri WHERE { <Russell_T_Davies> <notableWork> ?uri }
The pope whose shrine is in St Peter's Basilica was venerated in which sects?	SELECT DISTINCT ?uri WHERE { ?x <majorShrine> <St._Peter's_Basilica> . ?x <veneratedIn> ?uri  . ?x <type> <Pope>}
Politicians born in Bangalore are now in which parties?	SELECT DISTINCT ?uri WHERE { ?x <homeTown> <Bangalore> . ?x <party> ?uri  . }
Whose provides the service of Outlook and also products such as Visual Studio?	SELECT DISTINCT ?uri WHERE {?uri <services> <Outlook.com> . ?uri <products> <Microsoft_Visual_Studio>  . }
Which  science fiction show has Steven Moffat as executive producer ?	SELECT DISTINCT ?uri WHERE {?uri <executiveProducer> <Steven_Moffat> . ?uri <genre> <Science_fiction>  . ?uri <type> <TelevisionShow>}
Under which president did some politicians live in Kensington?	SELECT DISTINCT ?uri WHERE { ?x <residence> <Kensington,_Maryland> . ?x <president> ?uri  . ?x <type> <OfficeHolder>}
Who was the opponent of Robert Carr, 1st Earl of Somerset?	SELECT DISTINCT ?uri WHERE { <Robert_Carr,_1st_Earl_of_Somerset> <opponent> ?uri }
Which hockey team is coached by mike babcock?	SELECT DISTINCT ?uri WHERE {?uri <headCoach> <Mike_Babcock>  . ?uri <type> <HockeyTeam>}
What are other famous works of the writer who created the Sarah Jane Adventures?	SELECT DISTINCT ?uri WHERE { ?x <notableworks> <The_Sarah_Jane_Adventures> . ?x <notableWork> ?uri  . ?x <type> <Writer>}
How many broadcast area of the television stations exists whose broadcast area is Rodrigues?	SELECT DISTINCT COUNT(?uri) WHERE { ?x <broadcastArea> <Rodrigues> . ?x <broadcastArea> ?uri }
Who is the artist of the album which has the song I Can't Change the World ?	SELECT DISTINCT ?uri WHERE { <I_Can't_Change_the_World> <album> ?x . ?x <artist> ?uri  . }
What is the prize received by the one who wrote the screen play of The Postman  ?	SELECT DISTINCT ?uri WHERE { <The_Postman_(film)> <screenplay> ?x . ?x <award> ?uri  . }
What were the major actions taken by the politicians living in Gales Ferry, Connecticut?	SELECT DISTINCT ?uri WHERE { ?x <residence> <Gales_Ferry,_Connecticut> . ?x <battle> ?uri  . ?x <type> <Politician>}
Which newspapers are owned by organizations located in Oslo?	SELECT DISTINCT ?uri WHERE { ?x <location> <Oslo> . ?uri <owners> ?x  . }
Where was david Scherman trained ?	SELECT DISTINCT ?uri WHERE { <David_Scherman> <training> ?uri }
Laozi has authored which books?	SELECT DISTINCT ?uri WHERE {?uri <author> <Laozi>  . ?uri <type> <Book>}
Name the tenants of O.co Coliseum ?	SELECT DISTINCT ?uri WHERE { <O.co_Coliseum> <tenant> ?uri }
Where is the head quarters of the owner of Hamline Avenue?	SELECT DISTINCT ?uri WHERE { <Hamline_Avenue_(Metro_Transit_station)> <owner> ?x . ?x <headquarters> ?uri  . }
Which venues are located at places governed by John Roberts?	SELECT DISTINCT ?uri WHERE { ?x <leader> <John_Roberts> . ?uri <address> ?x  . ?uri <type> <Venue>}
Name the regions served by Toll Global Express ?	SELECT DISTINCT ?uri WHERE { <Toll_Global_Express> <regionServed> ?uri }
Name the club of Julie Hastings ?	SELECT DISTINCT ?uri WHERE { <Julie_Hastings> <club> ?uri }
Journals of how many fields can be found in US?	SELECT DISTINCT COUNT(?uri) WHERE { ?x <country> <United_States> . ?x <discipline> ?uri  . }
Which TV show's opening theme is The Best of Both Worlds (song) and executive producer is Steven Peterman?	SELECT DISTINCT ?uri WHERE {?uri <openingTheme> <The_Best_of_Both_Worlds_(song)> . ?uri <executiveProducer> <Steven_Peterman>  . ?uri <type> <TelevisionShow>}
For which team does Ramiro Pea play?	SELECT DISTINCT ?uri WHERE { <Ramiro_Peña> <team> ?uri }
Is Peter Crouch currently in the Stoke City FC?	ASK WHERE { <Peter_Crouch> <currentclub> <Stoke_City_F.C.> }
How many basketball players studied in the Midland College?	SELECT DISTINCT COUNT(?uri) WHERE {?uri <college> <Midland_College>  . ?uri <type> <BasketballPlayer>}
Name the TV show with theme music by Primus and broadcasted on Comedy Central?	SELECT DISTINCT ?uri WHERE {?uri <network> <Comedy_Central> . ?uri <themeMusicComposer> <Primus_(band)>  . ?uri <type> <TelevisionShow>}
Count the movies in Swedish language?	SELECT DISTINCT COUNT(?uri) WHERE {?uri <language> <Swedish_language>  . ?uri <type> <Film>}
For how many different teams have Ontarians been drafted?	SELECT DISTINCT COUNT(?uri) WHERE { ?x <placeOfBirth> <Ontario> . ?x <draftTeam> ?uri  . }
Miluk and Cayuse are still spoken in which part of the world?	SELECT DISTINCT ?uri WHERE { <Miluk_language> <region> ?uri. <Cayuse_language> <region> ?uri . }
Is Julia Gillard a part of monarch of elizabeth 2?	ASK WHERE { <Julia_Gillard> <monarch> <Elizabeth_II> }
List the maintainers of Pandaruan Bridge?	SELECT DISTINCT ?uri WHERE { <Pandaruan_Bridge> <maintainedBy> ?uri }
List the awards won by the film director of Chicken Run?	SELECT DISTINCT ?uri WHERE { <Chicken_Run> <director> ?x . ?x <award> ?uri  . }
Count the number of sports played by schools which play hockey ?	SELECT DISTINCT COUNT(?uri) WHERE { ?x <sport> <Hockey> . ?x <sport> ?uri }
Where are the Dinamo Krasnodar players born?	SELECT DISTINCT ?uri WHERE { ?x <club> <Dinamo_Krasnodar> . ?x <placeOfBirth> ?uri  . ?x <type> <Athlete>}
Where is the tomb of son of Bruce Lee?	SELECT DISTINCT ?uri WHERE { ?x <parent> <Bruce_Lee> . ?x <restingPlace> ?uri  . }
Did Alexandre Tichonov study at the Moscow university?	ASK WHERE { <Alexandre_Tichonov> <university> <Moscow> }
What are some other products of the banks which makes Postbanken?	SELECT DISTINCT ?uri WHERE { ?x <product> <Postbanken> . ?x <products> ?uri  . ?x <type> <Bank>}
What is the color of Xocolatlite ?	SELECT DISTINCT ?uri WHERE { <Xocolatlite> <colour> ?uri }
Is the song Only the Good Die Young from The Stranger?	ASK WHERE { <Only_the_Good_Die_Young> <fromAlbum> <The_Stranger_(album)> }
Who are the tenants of MasterCard Centre?	SELECT DISTINCT ?uri WHERE { <MasterCard_Centre> <tenants> ?uri }
For what was Jack Ryan a nominee?	SELECT DISTINCT ?uri WHERE { <Jack_Ryan_(politician)> <nominee> ?uri }
From how many countries did the aeroplanes designed by Alexander Lippisch originate?	SELECT DISTINCT COUNT(?uri) WHERE { ?x <designer> <Alexander_Lippisch> . ?x <nationalOrigin> ?uri  . ?uri <type> <Country>}
Which battle is Jim Jones associated with to which Allen Boyd is also associated ?	SELECT DISTINCT ?uri WHERE { <Jim_Jones_(judge)> <battle> ?uri. <Allen_Boyd> <battles> ?uri}
What city in the US was Alfred Phillips born in, and is the resting place of William Smith?	SELECT DISTINCT ?uri WHERE { <William_H._Smith_(Connecticut)> <restingPlace> ?uri. <Alfred_N._Phillips> <birthPlace> ?uri . }
What sport activities are available at Polytechnic University of the Philippines Bataan?	SELECT DISTINCT ?uri WHERE { <Polytechnic_University_of_the_Philippines_–_Bataan> <sport> ?uri }
Which governing body of the Oahu Railway and Land Company is also the military branch of the Jimmy Quillen?	SELECT DISTINCT ?uri WHERE { <Oahu_Railway_and_Land_Company> <governingBody> ?uri. <Jimmy_Quillen> <militaryBranch> ?uri}
Which are the races in which Martin Molony participated?	SELECT DISTINCT ?uri WHERE { <Martin_Molony> <race> ?uri }
Is Mike Babcock the head coach of Toronto Maple Leafs?	ASK WHERE { <Toronto_Maple_Leafs> <headCoach> <Mike_Babcock> }
Solon Spencer Beman has architected in how many cities?	SELECT DISTINCT COUNT(?uri) WHERE { ?x <architect> <Solon_Spencer_Beman> . ?x <locationTown> ?uri  . ?uri <type> <City>}
Where does the Giannis Alafouzos originate?	SELECT DISTINCT ?uri WHERE { <Giannis_Alafouzos> <stateOfOrigin> ?uri }
Which comic characters were created by Paul Dini?	SELECT DISTINCT ?uri WHERE {?uri <creators> <Paul_Dini>  . ?uri <type> <ComicsCharacter>}
What is the appliance which uses the central processing unit manufactured by Marvell Technology Group?	SELECT DISTINCT ?uri WHERE {?uri <cpu> <Marvell_Technology_Group>  . ?uri <type> <InformationAppliance>}
Which artist of Madagascar: Operation Penguin is also the writer of He's a Pirate ?	SELECT DISTINCT ?uri WHERE { <Madagascar:_Operation_Penguin> <artist> ?uri. <He's_a_Pirate> <writer> ?uri}
Name the cover artist of the adventure of Tom sawyer?	SELECT DISTINCT ?uri WHERE { <The_Adventures_of_Tom_Sawyer> <coverArtist> ?uri }
How many genres gave birth to other genres which emphasize Bass Guitars?	SELECT DISTINCT COUNT(?uri) WHERE { ?x <instruments> <Bass_guitar> . ?x <stylisticOrigin> ?uri  . ?uri <type> <MusicGenre>}
What type of engines are utilised by Purvis Eureka?	SELECT DISTINCT ?uri WHERE { <Purvis_Eureka> <engine> ?uri }
Which famous commander led the Siege of forn meigs and was involved in the battle of fort stephenson?	SELECT DISTINCT ?uri WHERE { <Siege_of_Fort_Meigs> <commander> ?uri. <Battle_of_Fort_Stephenson> <commander> ?uri . }
Which currency is primarily used by the company which is the distributing label of VDE-Gallo Records?	SELECT DISTINCT ?uri WHERE { <VDE-Gallo_Records> <distributingLabel> ?x . ?x <currency> ?uri  . ?x <type> <Organisation>}
What common teams do Ramiro Pea and Bruce Bochy share?	SELECT DISTINCT ?uri WHERE { <Ramiro_Peña> <team> ?uri. <Bruce_Bochy> <team> ?uri . }
Which newspapers are owned by Oslo citizens?	SELECT DISTINCT ?uri WHERE { ?x <location> <Oslo> . ?uri <owners> ?x  . ?uri <type> <Newspaper>}
Who is the employer of Michael M. Sears ?	SELECT DISTINCT ?uri WHERE { <Michael_M._Sears> <employer> ?uri }
In which cities were the chess grand masters born?	SELECT DISTINCT ?uri WHERE { ?x <title> <Grandmaster_(chess)> . ?x <birthPlace> ?uri  . }
Name the rive whose mouth is located in Limerick and location is Dowra?	SELECT DISTINCT ?uri WHERE {?uri <mouthLocation> <Limerick> . ?uri <sourceLocation> <Dowra>  . ?uri <type> <River>}
Where was Sino-French War fought ?	SELECT DISTINCT ?uri WHERE { <Sino-French_War> <territory> ?uri }
What are some movies whose distributors are led by Kevin Tsujihara?	SELECT DISTINCT ?uri WHERE { ?x <keyPerson> <Kevin_Tsujihara> . ?uri <distributor> ?x  . ?uri <type> <Film>}
What city gave birth to Mishal Raheja and also houses New India Assurance?	SELECT DISTINCT ?uri WHERE { <Mishal_Raheja> <birthPlace> ?uri. <New_India_Assurance> <location> ?uri . }
In which states are there bridges over the Pequea Creek?	SELECT DISTINCT ?uri WHERE { ?x <river> <Pequea_Creek> . ?x <state> ?uri  . ?x <type> <Bridge>}
What is the debut team of the baseball player who was born in Williamsburg, Kansas ?	SELECT DISTINCT ?uri WHERE { ?x <birthPlace> <Williamsburg,_Kansas> . ?x <debutteam> ?uri  . ?x <type> <BaseballPlayer>}
Gregg Toland cinematographed how many things?	SELECT DISTINCT COUNT(?uri) WHERE {?uri <cinematography> <Gregg_Toland>  . }
Whose units are responsible for close air support?	SELECT DISTINCT ?uri WHERE { ?x <role> <Close_air_support> . ?uri <militaryUnit> ?x  . }
Which tenants of the Master Card center is also the draft team of Sam Carrrick?	SELECT DISTINCT ?uri WHERE { <MasterCard_Centre> <tenants> ?uri. <Sam_Carrick> <draftTeam> ?uri}
Name the nationalteam of Trn Vit Hng ?	SELECT DISTINCT ?uri WHERE { <Trần_Việt_Hương> <nationalteam> ?uri }
What are the television shows whose Composer is Stewart Copeland?	SELECT DISTINCT ?uri WHERE {?uri <composer> <Stewart_Copeland>  . ?uri <type> <TelevisionShow>}
Who is the spouse of Willian Menalaus?	SELECT DISTINCT ?uri WHERE { <William_Menelaus> <spouse> ?uri }
Which politicians died in cities built by the Roman emperor Charles 5?	SELECT DISTINCT ?uri WHERE { ?x <builder> <Charles_V,_Holy_Roman_Emperor> . ?uri <deathPlace> ?x  . ?uri <type> <OfficeHolder>}
What is the debut team of the gridiron football player who coached the 1931 Staten Island Stapletons season ?	SELECT DISTINCT ?uri WHERE { <1931_Staten_Island_Stapletons_season> <coach> ?x . ?x <debutteam> ?uri  . ?x <type> <GridironFootballPlayer>}
List the common sports between Fr. Agnel Multipurpose School  and Jamiatu Muslim Mindanao	SELECT DISTINCT ?uri WHERE { <Fr._Agnel_Multipurpose_School_and_Junior_College> <sport> ?uri. <Jamiatu_Muslim_Mindanao> <athletics> ?uri}
Is the Charat district a district in Peru?	ASK WHERE { <Charat_District> <settlementType> <Districts_of_Peru> }
What awards have been given to the artists coming out of the University of Melbourne Faculty of VCA and MCM?	SELECT DISTINCT ?uri WHERE { ?x <training> <University_of_Melbourne_Faculty_of_VCA_and_MCM> . ?x <award> ?uri  . ?x <type> <Artist>}
Which ppolitical party of Yashpal Kapur is also the owner of National Herald ?	SELECT DISTINCT ?uri WHERE { <The_National_Herald_(India)> <owner> ?uri. <Yashpal_Kapur> <party> ?uri}
In which areas is the radio station broadcasted which is a sister station of WXME ?	SELECT DISTINCT ?uri WHERE { <WXME> <sisterStations> ?x . ?x <area> ?uri  . ?x <type> <RadioStation>}
Who appointed Joseph Clay and William Cushing to their office?	SELECT DISTINCT ?uri WHERE { <Joseph_Clay_(Georgia)> <appointer> ?uri. <William_Cushing> <appointer> ?uri . }
Horses sired by Karinga Bay have participated in which races?	SELECT DISTINCT ?uri WHERE { ?x <sire> <Karinga_Bay> . ?x <race> ?uri  . ?x <type> <Horse>}
Count the number of movies whose editors were born in UK?	SELECT DISTINCT COUNT(?uri) WHERE { ?x <birthPlace> <United_Kingdom> . ?uri <editing> ?x  . ?uri <type> <Film>}
Which animator of the The Skeleton Dance is also the director of The Haunted House (1929 film) ?	SELECT DISTINCT ?uri WHERE { <The_Skeleton_Dance> <animator> ?uri. <The_Haunted_House_(1929_film)> <director> ?uri}
Where do current famous NatGeo photographers live?	SELECT DISTINCT ?uri WHERE { ?x <knownFor> <National_Geographic_(magazine)> . ?x <residence> ?uri  . ?x <type> <Photographer>}
Who was the coach of 1972 Oakland Raiders season ?	SELECT DISTINCT ?uri WHERE { <1972_Oakland_Raiders_season> <coach> ?uri }
To which sports team is Aubie the mascot?	SELECT DISTINCT ?uri WHERE {?uri <mascot> <Aubie>  . ?uri <type> <SportsTeam>}
Name the team which is the owner of Dafenham wind turbines and stood first in 1967 mexican Grand Prix?	SELECT DISTINCT ?uri WHERE { <1967_Mexican_Grand_Prix> <firstTeam> ?uri. <Dagenham_wind_turbines> <owner> ?uri}
How many services does 21Vianet provide?	SELECT DISTINCT COUNT(?uri) WHERE { <21Vianet> <services> ?uri  . }
List all the wine regions of the grapes whose one of the wine region is Mississippi ?	SELECT DISTINCT ?uri WHERE { ?x <wineRegion> <Mississippi> . ?x <wineRegion> ?uri  . ?x <type> <Grape>}
Who was the president under which Joe Purcell is a lieutenant?	SELECT DISTINCT ?uri WHERE {?uri <lieutenant> <Joe_Purcell> }
Which destinations of the Air 2000 is also the location continent of the Falken Tire ?	SELECT DISTINCT ?uri WHERE { <Air_2000> <destinations> ?uri. <Falken_Tire> <locationCountry> ?uri}
What organisation regulates and controls the New Sanno Hotel?	SELECT DISTINCT ?uri WHERE { <New_Sanno_Hotel> <tenant> ?uri }
Which colonel has allegiance to Colony of Virginia ?	SELECT DISTINCT ?uri WHERE {?uri <allegiance> <Colony_of_Virginia> . ?uri <rank> <Colonel_(United_States)>  . ?uri <type> <OfficeHolder>}
Artists trained at art students league NY are buried where?	SELECT DISTINCT ?uri WHERE { ?x <training> <Art_Students_League_of_New_York> . ?x <restingPlace> ?uri  . ?x <type> <Artist>}
Which nation is the origin of Dornier Aerodyne?	SELECT DISTINCT ?uri WHERE { <Dornier_Aerodyne> <nationalOrigin> ?uri }
Which company founded in New Mexico manufactures Visual Studio?	SELECT DISTINCT ?uri WHERE {?uri <foundation> <New_Mexico> . ?uri <products> <Microsoft_Visual_Studio>  . ?uri <type> <Company>}
Give me all magazines whose founder died in Berkeley, California?	SELECT DISTINCT ?uri WHERE { ?x <deathPlace> <Berkeley,_California> . ?uri <founder> ?x  . ?uri <type> <Magazine>}
What is the mascot of the military unit of David Prowse?	SELECT DISTINCT ?uri WHERE { <David_Prowse_(politician)> <branch> ?x . ?x <mascot> ?uri  . }
Who has allegiance is Colony of Virginia and buried in Montpelier?	SELECT DISTINCT ?uri WHERE {?uri <allegiance> <Colony_of_Virginia> . ?uri <restingplace> <Montpelier_(Orange,_Virginia)>  . }
